,fac_nm,road_addr,jibun_addr,lat,lon,area,seat,oper_org,oper_org_pn,f_date,manage_agency,base_date
0,율천동 밤밭,경기도 수원시 장안구 서부로2181번길 55,경기도 수원시 장안구 율전동 150-7,37.303211,126.969733,115,34,새마을문고,031-293-0309,1997-04-01,수원시 장안구 가정복지과,2021-04-07
1,정자3동(청솔마을),경기도 수원시 장안구 만석로20번길 28,경기도 수원시 장안구 정자동 921,37.293859,126.984411,100,54,한라비발디입주자대표,031-308-5919,2003-07-24,수원시 장안구 가정복지과,2021-04-07
2,구운동,경기도 수원시 권선구 구운로47번길 57-33,경기도 수원시 권선구 구운동 965,37.277117,126.971467,47,42,새마을문고,031-292-9966,1994-02-10,수원시 권선구 가정복지과,2021-04-07
3,우만1동,경기도 수원시 팔달구 창룡대로210번길 13,경기도 수원시 팔달구 우만동 301,37.29235117,127.034214,216,60,우만종합사회복지관,031-254-1992,1992-07-01,수원시 팔달구 가정복지과,2021-04-07
4,영통1동(신명한국),경기도 수원시 영통구 봉명로 1770번길21,경기도 수원시 영통구 영통동 1054-3,37.267325,127.083073,79,54,신명한국아파트부녀회,031-203-1063,2003-07-01,수원시 영통구 가정복지과,2021-04-07
